Date,Relevance,Headline,Detail (Source)
16-Mar-20,0,Imperial College study published: over half a million Britons could die,"Even the Government’s “mitigation” approach could lead to 250,000 deaths and intensive care units being overwhelmed at least eight times over, the study finds. Imperial’s prediction of over 500,000 deaths is no different from a report by the Government’s own pandemic modelling committee two weeks earlier. (Reuters)"
16-Mar-20,0,"“Test, test, test"" says head of WHO","“You cannot fight a fire blindfolded. And we cannot stop this pandemic if we don’t know who is infected. We have a simple message for all countries: test, test, test.” - Director General of the World Health Organization, Tedros Adhanom. (WHO)"
16-Mar-20,0,"Johnson jokes that push to build new ventilators should be called ""Operation Last Gasp""",The comment is made during a conference call with CEOs to discuss life-saving ventilator production. (Politico)
16-Mar-20,0,France goes into lockdown (France24),
16-Mar-20,0,"The UK death toll from the pandemic reaches 55, with the number of cases of the illness passing 1,500.[75]",
16-Mar-20,0,"The government issues a call for businesses to support the supply of ventilators and ventilator components;[76] the NHS has access to 8,175 ventilators but it is thought that up to 30,000 may be needed.[77]",
16-Mar-20,0,The BBC delays its planned changes to TV licences for the over-75s from June to August because of the pandemic.[78],
16-Mar-20,0,"Theatres in London, as well as elsewhere around the UK, close following Boris Johnson's advice that people should avoid such venues.[79]",
17-Mar-20,0,The Foreign and Commonwealth Office advises against all non-essential international travel due to the pandemic and the border restrictions put in place by many countries in response.[83],
17-Mar-20,0,"20,000 deaths would be ""a good outcome"" – Government Chief Scientific Adviser (Telegraph)",
17-Mar-20,0,Official UK death toll reaches 100,Later analysis of excess deaths will show that this figure is likely half the actual total.
17-Mar-20,0,"NHS England announces that from 15 April all non-urgent operations in England will be postponed, to free up 30,000 beds to help tackle the virus.[80]",
17-Mar-20,0,"The Chancellor, Rishi Sunak, announces that £330bn will be made available in loan guarantees for businesses affected by the virus.[81][82]",
17-Mar-20,0,"The UK coronavirus-related death toll rises to 71, while the number of confirmed cases of the illness rises to 1,950.[84][85]",
17-Mar-20,0,"The UK government provides a £3.2million emergency support package to help rough sleepers into accommodation.[86][87] With complex physical and mental health needs, in general, homeless people are at a significant risk of catching the virus.[86]",
17-Mar-20,0,The National Assembly for Wales is closed to the public.[88],
17-Mar-20,0,"The BBC announces major changes to the schedule across the network. While programmes such as Politics Live, Victoria Derbyshire, The Andrew Neil Show, Newswatch, The Travel Show and HARDTalk have been suspended, others such as Newsnight and The Andrew Marr Show will continue with a smaller number of production staff. Question Time is moved to an earlier 8pm Thursday timeslot and will be broadcast without an audience from a fixed location. Podcasts programmes Americast, Beyond Today and The Next Episode are also suspended.[89]",
17-Mar-20,0,"Cinema chains Odeon, Cineworld, Vue and Picturehouse announce they will be closing all their UK outlets.[90]",
18-Mar-20,0,"Covid-19 is formally downgraded from Level 4 status, the highest threat level, to Level 3",This move enables the required standard of PPE to be lowered for hospital staff. (British Medical Journal)
18-Mar-20,0,"NHS staff ""thrown to the wolves"" by government over lack of PPE","The claim, from frontline NHS staff, follows acute shortages of PPE, including gowns, eye protection and face masks. (Bloomberg)"
18-Mar-20,0,"""Tracing every contact must be the backbone of the response in every country"" – WHO",
18-Mar-20,0,Six days since UK stopped contact tracing,"Despite the urging of the WHO, the UK has not reinstated contact tracing. Meanwhile, tracing continues to great effect in other countries tackling the virus, including Germany, South Korea and Singapore. Two months later the UK will still not have a national contact tracing app. (Guardian)"
18-Mar-20,0,"Pound sterling falls below $1.18, its lowest level since 1985.[91][92] Bank of England governor Andrew Bailey, commenting on the UK and wider economic situation, says: ""It's obviously an emergency. I think we're living in completely unparalleled times... It's going to be a very big downturn – we know that.""[93]",
18-Mar-20,0,"The UK death toll from coronavirus exceeds 100, with 32 new cases taking the total to 104.[94]",
18-Mar-20,0,"The government announces that all schools in the country will shut from the afternoon of Friday 20 March, except for those looking after the children of key workers and vulnerable children.[95] No exams will take place this academic year, Education Secretary Gavin Williamson confirms.[96]",
18-Mar-20,0,The Northern Ireland Assembly reduces its workload by suspending all non-essential Assembly business. It is closed to the public from the following day.[97],
18-Mar-20,0,"Princess Beatrice cancels her wedding reception at Buckingham Palace and will take further advice on whether to carry on with a private wedding ceremony, scheduled to take place on 29 May.[98]",
18-Mar-20,0,The 50th anniversary Glastonbury Festival is cancelled as a result of the pandemic.[99],
18-Mar-20,0,"The government announces emergency legislation to bring in a ban on new evictions for three months, as part of measures to help protect renters in social and private rented accommodation.[100]",
18-Mar-20,0,"The BBC announces that due to the coronavirus pandemic, filming on Casualty, Doctors, EastEnders, Holby City, Pobol y Cwm and River City is suspended until further notice. Weekly episodes of EastEnders will also be reduced from four to two to keep it on the air for as long as possible.[101]",
18-Mar-20,0,MP Lloyd Russell-Moyle announces that he has tested positive with the virus.[102],
19-Mar-20,0,Coronavirus patients sent back to care homes,A Government diktat tells NHS hospitals to move elderly patients into care homes without testing for Covid-19. A Whitehall official will later state that the policy was designed as a “stiff broom” to free up capacity in hospitals. The policy is linked to a later explosion of cases in care homes. (Telegraph)
19-Mar-20,0,UK closes schools and pubs,"The UK finally closes schools, cafes, pubs and restaurants. The move comes later than in any comparable European country. (BBC)"
19-Mar-20,0,The first COVID-19 death is confirmed in Northern Ireland.[103],
19-Mar-20,0,"The Ministry of Defence announces the formation of the COVID Support Force, enabling the military to support public services and civilian authorities in tackling the outbreak.[104] Two military operations are also announced: Operation Rescript, which focuses on the outbreak in the United Kingdom; and Operation Broadshare, which focuses on British military activities overseas.[105]",
19-Mar-20,0,"In an emergency move, the Bank of England cuts interest rates again, from 0.25% to just 0.1%. This is the lowest rate in the Bank's 325-year history.[106]",
19-Mar-20,0,"The government announces £1.6bn for local authorities, to help with the cost of adult social care and support for the homeless; and £1.3bn to the NHS and social care, to allow up to 15,000 people to be discharged from hospital.[107]",
20-Mar-20,1,"Prime Minister Boris Johnson orders all cafes, pubs and restaurants to close from the evening of 20 March, except for take-away food, to tackle coronavirus. All the UK's nightclubs, theatres, cinemas, gyms and leisure centres are told to close ""as soon as they reasonably can"".[110]",
20-Mar-20,0,"Chancellor Rishi Sunak announces that the government will pay 80% of wages for employees not working, up to £2,500 a month, as part of ""unprecedented"" measures to protect people's jobs.[109]",
20-Mar-20,0,"Government adviser claims PPE shortages ""completely resolved""","“The country has a perfectly adequate supply of PPE,” says Deputy Chief Medical Officer Jenny Harries, stating that supply issues have been ""completely resolved"". Two weeks later the British Medical Association will report acute shortages in dozens of NHS trusts across the UK, putting frontline NHS staff at risk. (The Lancet)"
20-Mar-20,0,Johnson tells the nation he is hoping to see his mother on Mother's Day,"""I hope to get to see her,"" he tells Downing Street press conference. (Independent)"
20-Mar-20,0,Official UK death toll reaches 200,Later analysis of excess deaths will show that this figure is likely half the actual total.
20-Mar-20,0,"Northwick Park Hospital in Harrow declares a ""critical incident"" due to a surge in patients with coronavirus.[108]",
21-Mar-20,0,"Under pressure, Johnson now tells people not to visit their mothers on Mother's Day (Daily Mail)",
21-Mar-20,0,"Environment Secretary George Eustice urges shoppers to stop panic buying, as supermarkets around the UK struggle to keep up with demand.[111] Tesco, Asda, Aldi, and Lidl are reported to have begun a recruitment drive for up to 30,000 new staff.[112]",
21-Mar-20,0,"NHS England negotiates a cost-price ""block booking"" of almost all services and facilities at the country's private hospitals, involving around 8,000 hospital beds, nearly 1,200 ventilators, and more than 10,000 nurses.[113]",
21-Mar-20,0,"The Driver and Vehicle Standards Agency announces that all pending practical and driving theory tests are to be postponed, for at least three months in the case of practical tests, and up to and including 20 April for theory tests. All candidates are to receive notification of when their tests are rescheduled.[114][115]",
22-Mar-20,0,UK finally goes into lockdown,"A cabinet source will later state: “We didn’t want to go down this route in the first place – public and media pressure pushed the lockdown, we went with the science."" In reality, many scientists were urging a much earlier lockdown. (Telegraph)"
22-Mar-20,0,"The Nursing and Midwifery Council announces that more than 5,600 former nurses have registered to offer their services in the fight against coronavirus.[116]",
22-Mar-20,0,"Boris Johnson warns that ""tougher measures"" may be introduced if people do not follow government advice on social distancing.[117]",
22-Mar-20,0,"Downing Street confirms Foreign Secretary Dominic Raab will act in place of Prime Minister Boris Johnson if he becomes ""incapacitated"".[118]",
22-Mar-20,0,"The UK death toll reaches 281, including what is reported to be the virus's youngest victim so far, an eighteen-year-old with underlying health problems.[117]",
23-Mar-20,1,"In a televised address, Boris Johnson announces a UK-wide partial lockdown, to contain the spread of the virus. The British public are instructed that they must stay at home, except for certain ""very limited purposes"" – shopping for basic necessities; for ""one form of exercise a day""; for any medical need; and to travel to and from work when ""absolutely necessary"". However, when these restrictions came into force on 26 March, the statutory instrument omitted any limit on the number of exercise sessions.[123] A number of other restrictions are imposed, with police given powers to enforce the measures, including the use of fines.[124][125][126]",
23-Mar-20,0,Official UK death toll reaches 400,Later analysis of excess deaths will show that this figure is likely half the actual total.
23-Mar-20,0,"The government announces emergency measures to safeguard the nation's rail network, with season ticket holders given refunds if working from home, and rail franchise agreements nationalised for at least six months to prevent rail companies from collapsing.[120][121]",
23-Mar-20,0,"Pride in London, the UK's largest LGBT Pride festival, scheduled for 27 June, is the latest event to be postponed. It is one of a hundred pride events to be postponed or cancelled in the UK.[122]",
24-Mar-20,0,"For the first time, all of the UK's mobile networks send out a government text alert, ordering people to stay at home. The message reads: ""GOV.UK CORONAVIRUS ALERT. New rules in force now: you must stay at home. More info and exemptions at gov.uk/coronavirus Stay at home. Protect the NHS. Save lives.""[128]",
24-Mar-20,0,Government strategy slammed by scientists,"In damning testimony to a Parliamentary committee, Lancet editor Richard Horton slams the Government for failing to heed evidence of the severity of coronavirus back in January and thinking it could manage ""a controlled epidemic"". (House of Commons Science and Technology Committee)"
24-Mar-20,0,"The UK records its highest number of coronavirus deaths in one day, after a further 87 people die across the country, bringing the total to 422.[127]",
24-Mar-20,0,"Health Secretary Matt Hancock announces the government will open a temporary hospital, the NHS Nightingale Hospital at the ExCeL London, to add extra critical care capacity in response to coronavirus pandemic.[129]",
24-Mar-20,0,"The Scottish Parliament closes, with plans to reconvene on 1 April to discuss emergency legislation.[130]",
24-Mar-20,0,BBC News announces that it is delaying plans to cut 450 news jobs due to the pressure of covering the coronavirus pandemic.[131],
25-Mar-20,0,Routine dental care is suspended in England.[139][140],
25-Mar-20,0,Brexit over breathing?,"The Prime Minister is accused of putting ""Brexit over breathing"" by not joining the EU ventilator procurement scheme. When asked why the Government did not join the scheme, the PM's spokesperson replies: ""Because we're no longer members of the EU."" The European Commission confirms that the UK was indeed entitled to participate. The UK Government then changes its story, saying it hadn't taken advantage of the procurement scheme because it had missed an email due to a ""communication problem"". (Politics Home)"
25-Mar-20,0,Prince Charles tests positive for COVID-19.[132],
25-Mar-20,0,Parliament shuts down for a month.[133],
25-Mar-20,0,"British Transport Police deploys 500 officers to patrol the UK's rail network, in an effort to discourage non-essential journeys. New measures are also introduced on the London Underground to reduce passenger numbers.[134]",
25-Mar-20,0,"British diplomat Steven Dick, deputy ambassador to Hungary, dies in Budapest after contracting the virus.[135]",
25-Mar-20,0,"The police will be given the power to use ""reasonable force"" to enforce the lockdown regulations.[136]",
25-Mar-20,0,"The first two working NHS doctors die from COVID-19 on the same day, one a GP, the other a surgeon.[137]",
25-Mar-20,0,The Contingencies Fund Act 2020 receives royal assent.[138],
26-Mar-20,0,UK Government places PPE order with t-shirt and tracksuit salesman,"An Istanbul-based t-shirt salesman sees a UK Government appeal for PPE and sends an email to the Department for Health. The Government agrees to buy 400,000 gowns from him. (Telegraph)"
26-Mar-20,0,"The number of UK coronavirus deaths increases by more than 100 in a day for the first time, rising to 578, while a total of 11,568 have tested positive for the virus.[141]",
26-Mar-20,0,"The government announces that the self-employed will be paid 80% of profits, up to £2,500 a month, to help them cope during the economic crisis triggered by COVID-19.[142]",
26-Mar-20,0,"At 8pm, millions of people around the country take part in a ""Clap for Carers"" tribute, applauding the NHS and other care workers.[143]",
26-Mar-20,0,"The 2020 Isle of Wight and Download music festivals, scheduled for June, are cancelled.[144] The organisers of the Download festival subsequently announce plans to hold a virtual festival to be held on the dates it would have happened, and featuring streamed performances and interviews.[145]",
26-Mar-20,0,"The National Theatre launches National Theatre at Home, a two-month programme whereby a different production from its archives will be streamed for free each week. The project begins with Richard Bean's comedy One Man, Two Guvnors, featuring James Corden.[146]",
27-Mar-20,0,"Official UK death toll reaches 1,000",Later analysis of excess deaths will show that this figure is likely half the actual total.
27-Mar-20,0,Boris Johnson and Health Secretary Matt Hancock announce they have tested positive for coronavirus,Dominic Cummings is seen running from Downing Street shortly after the announcement. (Telegraph)
27-Mar-20,0,"The number of deaths increases by 181 from the previous day, bringing the total to 759, while 14,579 cases have been confirmed.[147]",
27-Mar-20,0,"Prime Minister Boris Johnson and Health Secretary Matt Hancock both test positive for COVID-19, Johnson will self-isolate in 10 Downing Street and Hancock is self-isolating at home whilst working.[148][149]",
27-Mar-20,0,"Labour Party MP Angela Rayner, the Shadow Secretary of State for Education, confirms she has been suffering symptoms and is self-isolating.[150]",
27-Mar-20,0,"Chief Medical Adviser Chris Whitty reports suffering from symptoms and is self-isolating, while continuing to advise the UK government.[151]",
27-Mar-20,0,"Leon Restaurants sets up the ""Feed NHS"" initiative to deliver 5,600 free meals a day to NHS critical care staff at London hospitals.[152]",
27-Mar-20,0,The 2020 Cambridge Folk Festival is cancelled.[153],
27-Mar-20,0,"Dominic Cummings, Johnson's lead adviser, drives 250 miles to Durham because ""there was nobody in London that [he] could reasonably ask to look after [his] child"".[154]",
28-Mar-20,0,Dominic Cummings drives to Durham,"Despite his wife being ill with suspected Covid-19 and himself exhibiting possible symptoms, this weekend Cummings drives his wife and child to his parents' country home in Durham, later sparking a national controversy. With the country in lockdown, the 260 mile trip from London is counter to Government rules which Cummings himself helped to write. (Telegraph)"
28-Mar-20,0,"Alister Jack, the Secretary of State for Scotland, announces that he is self-isolating after experiencing coronavirus symptoms.[155]",
28-Mar-20,0,"A further 260 deaths takes the number of fatalities past 1,000, with a total of 1,019 deaths having occurred so far; 17,089 people have tested positive.[156]",
28-Mar-20,0,"At 11pm, new regulations come into force in Northern Ireland giving authorities the power to force businesses to close, and impose fines on them if they refuse, as well as on people leaving their homes without a ""reasonable excuse"". The measures, introduced by the Northern Ireland Executive, bring Northern Ireland into line with the rest of the UK.[157][158]",
29-Mar-20,0,"Official UK death toll reaches 2,000",Later analysis of excess deaths will show that this figure is likely half the actual total.
29-Mar-20,0,"Herd immunity strategy intolerable, New Zealand PM","""There were some countries who initially talked about herd immunity as a strategy. In New Zealand we never ever considered that as a possibility, ever. Herd immunity would’ve meant tens of thousands of New Zealanders dying and I simply would not tolerate that and I don’t think any New Zealander would"" – Jacinda Ardern, Prime Minister of New Zealand. (TVNZ)"
29-Mar-20,0,"The government will send a letter to 30 million households warning things will ""get worse before they get better"" and that tighter restrictions could be implemented if necessary. The letter will also be accompanied by a leaflet setting out the government's lockdown rules along with health information.[159]",
29-Mar-20,0,"Dr Jenny Harries, England's deputy chief medical officer, suggests it could be six months before life can return to ""normal"", because social distancing measures will have to be reduced ""gradually"".[160]",
29-Mar-20,0,The first NHS nurse dies of COVID-19.[137],
30-Mar-20,0,"As the number of reported deaths rises to 1,408, Patrick Vallance, the UK's chief scientific adviser, says there are early signs social distancing measures are ""making a difference"". Transmission of the virus within the community is thought to be decreasing, and hospital admission data suggests cases are not rising as fast as anticipated.[161]",
30-Mar-20,0,Foreign Secretary Dominic Raab announces an arrangement between the government and major UK airlines to fly home tens of thousands of British nationals who are stranded abroad by the coronavirus outbreak.[162],
30-Mar-20,0,"Dominic Cummings, the Prime Minister's Chief Adviser, is reported to be self-isolating after experiencing coronavirus symptoms.[163]",
31-Mar-20,0,"A significant rise in anxiety and depression among the UK population is reported following the lockdown. The study, by researchers from the University of Sheffield and Ulster University, finds that people reporting anxiety increased from 17% to 36%, while those reporting depression increased from 16% to 38%.[164]",
31-Mar-20,0,"The number of people in hospital with COVID-19 passes 10,000.[165]",
31-Mar-20,0,"The largest UK daily death toll of the outbreak so far is reported, with 381 deaths taking the total to 1,789.[166]",
01-Apr-20,0,"Just 2,000 of 1.2 million NHS staff have been tested, the Government admits","Only 150,000 tests have been carried out across the UK. (Evening Standard)"
01-Apr-20,0,"Germany carrying out 50,000 tests per day (Financial Times)",
01-Apr-20,0,Government contacts the UK's testing industry for the first time,"The revelation comes from the British In Vitro Diagnostics Association, which represents 110 companies that make up most of the UK’s testing sector. (Financial Times)"
01-Apr-20,0,PPE crisis deepens,"PPE shortages reported in more than 30 hospital trusts, according to the British Medical Association. (Guardian)"
01-Apr-20,0,"The UK government confirms that a total of 2,000 NHS staff have been tested for coronavirus since the outbreak began, but Cabinet Office Minister Michael Gove says a shortage of chemical reagents needed for COVID-19 testing means it is not possible to screen the NHS's 1.2 million workforce.[167] Gove's statement is contradicted by the Chemical Industries Association, which says there is not a shortage of the relevant chemicals and that at a meeting with a business minister the week before the government had not tried to find out about potential supply problems.[168]",
01-Apr-20,0,"The number of deaths is confirmed to have increased by 563 to 2,362, while a total of 29,474 cases have been diagnosed, 4,324 over the previous 24 hours.[167]",
01-Apr-20,0,The contactless payment limit for in-store spending is raised from £30 to £45.[169],
01-Apr-20,0,The National Assembly for Wales reconvenes using Zoom for a virtual emergency Senedd meeting.[170],
01-Apr-20,0,Multinational pharmaceutical company Roche denies the existence of a deal to supply Wales with COVID-19 tests after First Minister Mark Drakeford and Health Minister Vaughan Gething blame the collapse of a deal for a shortage of testing kits.[171],
01-Apr-20,0,"The 2020 Edinburgh festivals, planned for August, are cancelled.[172]",
02-Apr-20,1,UK death toll now bigger than China (Daily Mail),
02-Apr-20,0,"Matt Hancock, who returns to give the daily government briefing after completing his self-isolation, sets a target of carrying out 100,000 tests a day by the end of the month (encompassing both swab tests and blood tests).[173]",
02-Apr-20,0,"The government writes off historical debts totalling £13.4bn of over 100 hospital trusts, an action which had been under consideration since before the onset of the pandemic.[174]",
02-Apr-20,0,At 8pm the UK gives another national round of applause for NHS staff and other key workers.[175],
03-Apr-20,0,"Official UK death toll reaches 4,000",Later analysis of excess deaths will show that this figure is likely half the actual total.
03-Apr-20,0,"Figures published by the Cabinet Office indicate UK road traffic levels have fallen by 73% since the lockdown measures were introduced, and are at their lowest since 1955.[177]",
03-Apr-20,0,NHS Nightingale opened,"The London hospital was built in just nine days and opened to much fanfare. In the following 17 days, however, the hospital will treat just 41 Covid-19 patients, while turning away 50 more requiring critical care largely due to a shortage of nurses. (Guardian)"
03-Apr-20,0,"NHS Nightingale Hospital London, the first temporary hospital to treat coronavirus patients, opens at the ExCel centre in East London, employing NHS staff and military personnel, with 500 beds and potential capacity for 4,000. It is the first of several such facilities planned across the UK.[176]",
03-Apr-20,0,"With warm weather forecast for some areas during the upcoming weekend, Matt Hancock warns people to stay at home, telling them this is an instruction ""not a request"".[178]",
03-Apr-20,0,The Queen holds the first virtual meeting with the Privy Council.[179],
04-Apr-20,0,"""Game changer"" antibody tests are a failure","17.5 million antibody tests ordered by the Government – which Boris Johnson described as a ""game changer"" – are found to be unreliable, failing to detect up to half of coronavirus cases. (Guardian)"
04-Apr-20,0,"The death total is reported as 4,313, having risen by 708 from the previous day's figure.[180]",
04-Apr-20,0,"It is announced that a five-year-old has died from the virus, believed to be the youngest victim to date.[181]",
