Date,Relevance,Headline,Detail (Source)
04-Apr-20,0,"The results of the 2020 Labour Party leadership election and the 2020 Labour Party deputy leadership election are announced, in which Keir Starmer is elected as the leader of the Labour Party, succeeding Jeremy Corbyn, and Angela Rayner is elected as deputy leader of the party. The results are released by email after a public event to announce the results was cancelled due to the pandemic.[182]",
05-Apr-20,0,"Queen Elizabeth II makes a rare broadcast to the UK and the wider Commonwealth, something she has done on only four previous occasions. In the address she thanks people for following the government's social distancing rules, pays tribute to key workers, and says the UK ""will succeed"" in its fight against coronavirus but may have ""more still to endure"".[183][184]",
05-Apr-20,0,"Johnson admitted to hospital with ""persistent symptoms"" (CNN)",
05-Apr-20,0,Thousands of contact tracing experts unused in UK,The Government is criticised for failing to deploy thousands of contact tracing experts it has at its disposal. It will be another 11 days before ministers announce plans to restart contact tracing. (Guardian)
05-Apr-20,0,Prime Minister Boris Johnson is admitted to hospital for tests after testing positive for coronavirus ten days earlier.[185],
05-Apr-20,0,"Matt Hancock says the goal for the number of ventilators has been reduced to 18,000 and that the NHS has between 9,000 and 10,000 available.[186]",
05-Apr-20,0,"Catherine Calderwood, Scotland's chief medical officer, resigns from her post after it emerged she had been spoken to by police for visiting her second home during lockdown.[187]",
05-Apr-20,0,Manchester City football club begins a disciplinary procedure against Kyle Walker after it was reported that he broke lockdown rules by inviting two sex workers to his home.[188][189],
06-Apr-20,0,"The death toll from COVID-19 in the UK exceeds 5,000. The total number of reported cases is nearly 52,000.[190]",
06-Apr-20,0,Johnson is moved to intensive care unit as his condition worsens (BBC News),
06-Apr-20,0,Prime Minister Boris Johnson is taken into intensive care at St Thomas' Hospital. It is announced that First Secretary of State Dominic Raab will deputise for him.[191],
06-Apr-20,0,The Orange Lodge of Ireland announces that the traditional Twelfth of July parades in Northern Ireland have been cancelled for 2020.[192],
06-Apr-20,0,National Express suspends all its long-distance coach services.[193],
07-Apr-20,0,Still nowhere near enough tests being carried out in the UK,"To date, only 208,000 tests have been carried out in the UK - just one-fifth of those conducted in Germany. (Fortune)"
07-Apr-20,0,"The number of reported deaths increases by 786, taking the total to 6,159. Sir Patrick Vallance, the government's chief scientific adviser, says that the figures are not accelerating as had been predicted but that it is too early to tell whether the outbreak is peaking.[194][195]",
07-Apr-20,0,The Northern Ireland Assembly establishes a COVID-19 Response Committees.[196],
08-Apr-20,0,Dominic Cummings visits Barnard Castle,"Johnson's top adviser is spotted with his child and wife (on her birthday) visiting local beauty spot Barnard Castle. In a bizarre press conference, Cummings will later claim he had only undertaken the 60 mile round trip in order to test his eyesight. (Guardian)"
08-Apr-20,0,"A further 938 deaths are reported in the UK, taking the total to 7,097.[197]",
08-Apr-20,0,"Mark Drakeford, the First Minister of Wales, confirms the Welsh Government will extend the lockdown beyond the initial three-week period for Wales.[198]",
08-Apr-20,0,"The Resolution Foundation, using figures from the British Chambers of Commerce, reports that more than nine million workers are expected to be furloughed under the government's job retention scheme, with an estimated cost to the taxpayer of between £30 and 40bn.[199]",
09-Apr-20,0,"The number of daily recorded deaths increases by 881, taking the total to 7,978. Dominic Raab says the UK is ""starting to see the impact"" of the restrictions but it is ""too early"" to lift them, and urges people to stay indoors over the upcoming Easter weekend.[200] With warm weather forecast again for Easter, this message is echoed by police and tourist destinations.[201] Johnson was moved out of intensive care, but remained in hospital.[202]",
09-Apr-20,0,"Foreign Secretary Dominic Raab says the UK is ""starting to see the impact"" of the restrictions but that it is ""too early"" to lift them, and urges people to stay indoors over the Easter weekend.[203]",
09-Apr-20,0,"Prime Minister Boris Johnson is moved out of intensive care, but remains in hospital.[204]",
09-Apr-20,0,At 8pm the nation stages a third round of applause for NHS staff and other key workers.[205],
10-Apr-20,0,"The UK records another 980 deaths taking the total to 8,958.[206]",
10-Apr-20,0,"Jonathan Van-Tam, England's deputy chief medical officer, tells the UK Government's daily briefing the lockdown is ""beginning to pay off"" but the UK is still in a ""dangerous situation"", and although cases in London have started to drop they are still rising in Yorkshire and the North East.[207]",
10-Apr-20,0,"Matt Hancock tells the briefing a ""Herculean effort"" is being made to ensure daily deliveries of personal protective equipment (PPE) to frontline workers, including the establishment of a domestic manufacturing industry to produce the equipment. Fifteen drive-through testing centres have also been opened around the UK to test frontline workers.[208]",
10-Apr-20,0,"Beginning today, England's Care Quality Commission requires care homes to state in daily death notifications whether the death was a result of confirmed or suspected COVID-19. The CQC has not previously published statistics; the data will in future be included in weekly reports from the Office of National Statistics.[209]",
11-Apr-20,1,"The number of people in London hospitals for COVID-19 reaches its peak, according to week-on-week change data; elsewhere in the country, patient numbers continue to increase, although the rate of increase is slowing.[213]",
11-Apr-20,0,"Queen Elizabeth II makes her first ever Easter message to the nation, in which she states ""coronavirus will not overcome us"" and that ""we need Easter as much as ever.""[210]",
11-Apr-20,0,"The number of reported deaths increases by 917, taking the total to 9,875.[211]",
11-Apr-20,0,"After some NHS workers say they still do not have the correct personal protective equipment to treat patients, Home Secretary Priti Patel tells that day's Downing Street briefing she is ""sorry if people feel there have been failings"" in providing kit.[212]",
11-Apr-20,0,"Occupancy of critical care beds in England peaks at around 58% of capacity. Occupancy in the month of April for Scotland and Wales will only briefly exceed 40%, while Northern Ireland reported a peak of 51% early in the month.[214]",
12-Apr-20,0,"Official UK death toll reaches 10,000",Later analysis of excess deaths will show that this figure is likely half the actual total.
12-Apr-20,0,"The number of people who died in hospital with coronavirus in the UK passes 10,000, after a daily rise of 737 to 10,612. Matt Hancock describes it as a ""sombre day"".[216]",
12-Apr-20,0,Relief as Johnson leaves hospital (Guardian),
12-Apr-20,0,"Flights still bringing 15,000 people a day into UK without virus testing, including travellers from China, Italy & the US (The Sun)",
12-Apr-20,0,Prime Minister Boris Johnson is discharged from hospital after being treated for coronavirus and will continue his recovery at Chequers.[215],
12-Apr-20,0,The temporary Dragon's Heart Hospital opens at Cardiff's Principality Stadium to admit its first patients.[217],
13-Apr-20,0,"The number of reported deaths increases by 717 to 11,329.[218]",
13-Apr-20,0,"Dominic Raab tells the Downing Street briefing the government does not expect to make any immediate changes to the lockdown restrictions and that the UK's plan ""is working [but] we are still not past the peak of this virus"".[219]",
14-Apr-20,0,"The Office for National Statistics indicates that coronavirus was linked to one in five deaths during the week ending 3 April. More than 16,000 deaths in the UK were recorded for that week, 6,000 higher than would be the average for that time of year.[221]",
14-Apr-20,0,"The number of reported deaths increases by 778 to 12,107.[220]",
14-Apr-20,0,"Several UK charities, including Age UK and the Alzheimer's Society, express their concern that older people are being ""airbrushed"" out of official figures because they focus on hospital deaths and do not include those in care homes or a person's own home. Responding to these concerns, Therese Coffey, the Secretary of State for Work and Pensions, says that hospital figures are being used because ""it's accurate and quick"".[222]",
14-Apr-20,0,Mobile operators report a further twenty attempted arson attacks on mobile phone masts over the previous weekend.[223],
15-Apr-20,0,"The number of recorded deaths rises by 761 to 12,868.[224]",
15-Apr-20,0,Health Secretary Matt Hancock announces new guidelines that will allow close family members to see dying relatives in order to say goodbye to them. Hancock also launches a new network to provide personal protective equipment to care home staff.[225],
15-Apr-20,0,"NHS England and the Care Quality Commission begin rolling out tests for care home staff and residents as it is reported the number of care home deaths are rising but that official figures, which rely on death certificates, are not reflecting the full extent of the problem. Helen Whately, the Minister for Social Care, says that the government are aware the figures are being understated.[226]",
15-Apr-20,0,"Arlene Foster, the First Minister of Northern Ireland, extends the period of lockdown in Northern Ireland to 9 May.[227]",
15-Apr-20,0,"The 2020 Love Supreme Jazz Festival, scheduled for July, is cancelled.[228]",
16-Apr-20,1,"Foreign Secretary Dominic Raab announces a three-week extension to the nationwide lockdown measures as the number of confirmed COVID-19 cases in the UK surpasses 100,000.[232]",
16-Apr-20,0,"""I would love to be able to wave a magic wand and have PPE fall from the sky” – Health Secretary Matt Hancock",The UK has now missed at least four opportunities to join the EU's joint PPE procurement scheme. (BBC News)
16-Apr-20,0,"The number of recorded deaths increases by 861 to 13,729.[229]",
16-Apr-20,0,"A 99-year-old war veteran, Tom Moore, completes 100 laps of his garden,[230] eventually raising over £25 million for NHS Charities Together, with over a million people donating via his JustGiving page.[231]",
16-Apr-20,0,"The NHS Nightingale Hospital Birmingham, at the National Exhibition Centre, is officially opened by Prince William.[233]",
16-Apr-20,0,The UK stages a fourth round of applause for NHS staff and key workers at 8pm.[234],
16-Apr-20,0,"A spokesperson for Princess Beatrice of York and Edoardo Mapelli Mozzi confirms that their wedding, scheduled for 29 May, will be held on a later date.[235]",
17-Apr-20,0,Government's ventilator plan falls apart,Ministers' call for UK manufacturers to embody the 'Blitz spirit' and shift their manufacturing capacity to ventilators has largely been a tactical misstep. A lack of clarity over what was needed saw the majority of non-specialist manufacturers trying to 'reinvent the wheel' and submit prototypes for ventilators which are unsuitable for treating Covid-19 patients. (Financial Times)
17-Apr-20,0,"Government announces that the 400,000 gowns are due to arrive from Turkey the following day",The gowns do not arrive. (BBC News)
17-Apr-20,0,"The number of recorded deaths rises by 847 taking the total to 14,576.[236]",
17-Apr-20,0,"Matt Hancock confirms coronavirus tests will be rolled out to cover more public service staff such as police officers, firefighters and prison staff.[237]",
17-Apr-20,0,"Chancellor Rishi Sunak extends the subsidised wage scheme for furloughed workers for another month, to the end of June.[238]",
17-Apr-20,0,"Later analysis of death registrations (all causes) in England and Wales by the Office for National Statistics finds the highest total this week, which at 21,805 is 207% of the five-year average for the same week. COVID-19 is mentioned in 8,730 cases.[239]",
18-Apr-20,0,"Care England, the UK's largest care homes representative body, estimates that as many as 7,500 care home residents may have died because of coronavirus, compared to the official figure of 1,400 released a few days earlier.[241]",
18-Apr-20,0,"Personal protective equipment is running out, Government admits (Guardian)",
18-Apr-20,0,"Imran Ahmad-Khan, the MP for Wakefield, secures a shipment of 110,000 reusable face masks through his connections with charity Solidarités international and the Vietnamese Government for Mid Yorkshire Hospitals NHS Trust to help tackle the shortage of PPE.[240]",
18-Apr-20,0,Unions representing doctors and nurses express their concern at a change in government guidelines advising medics to reuse gowns or wear other kit if stocks run low.[241],
18-Apr-20,0,"Speaking at the Downing Street daily briefing, Robert Jenrick, the Communities Secretary, says a further 400,000 gowns will be arriving from Turkey the following day.[242] (In the event, the shipment was delayed by several days,[243] and was said on 7 May to be unusable).[244]",
18-Apr-20,0,"The number of recorded deaths rises by 888 to 15,464.[245]",
18-Apr-20,0,"Jenrick announces a further £1.6bn of support for local authorities, on top of £1.6bn that was given to them on 19 March.[246]",
18-Apr-20,0,"Jenrick says that the virus appears to be having a ""disproportionate impact"" on the Black, Asian and minority ethnic (BAME) communities, while Stephen Powis says he has asked Public Health England to investigate what may be accounting for the increased risk within these groups.[246]",
18-Apr-20,0,Jenrick says that parks and cemeteries must remain open during the lockdown.[247],
19-Apr-20,0,"Frontline staff left exposed as 400,000 promised gowns do not arrive",
19-Apr-20,0,Government has failed to secure promised PPE,"The Government has failed to secure 16 million face masks for the NHS in the past month, it is revealed, as manufacturers' offers of help were repeatedly met with silence. Instead, millions of pieces of PPE are being shipped from the UK to Europe. (Telegraph)"
19-Apr-20,0,"The number of recorded deaths increases by 596 to 16,060, a lower increase than previous days. Dr Jenny Harries says the lower number of deaths is ""very good news"" but cautions against drawing conclusions from the figures.[248]",
19-Apr-20,0,"After a Sunday Times article suggests schools could reopen on 11 May, Gavin Williamson, the Secretary of State for Education, tells the Downing Street daily briefing he cannot give a date for when this will happen, and that the focus will be on helping children to learn at home, with lessons made available online and free loans of laptops for disadvantaged children.[248]",
19-Apr-20,0,"BBC One airs a UK version of the Together at Home concert, a virtual global concert staged to celebrate healthcare workers and featuring musicians playing from home. The two-hour broadcast includes highlights of the US version and features stories of frontline workers along with extra footage of British artists.[249][250]",
20-Apr-20,0,"To protect bus drivers, Transport for London puts buses' front doors out of use, requiring passengers to board through the middle doors. Passengers are no longer required to pay, so that they do not need to use the card reader near the driver.[251]",
20-Apr-20,0,"Online applications for the Coronavirus Job Retention Scheme are opened, with 67,000 claims registered in the first 30 minutes.[252]",
20-Apr-20,0,NHS Blood and Transplant asks those who have survived COVID-19 to donate blood for trials of a treatment that will involve giving the blood plasma of survivors to patients ill in hospital with the disease.[253],
20-Apr-20,0,"The number of recorded deaths rises by 449, taking the total to 16,509, but Prof Dame Angela Maclean, the UK's deputy chief scientific adviser, says the number of confirmed cases is ""flattening out"".[254] The number of people in hospital for COVID-19 has begun to fall in Scotland, Wales and every region of England, with significant falls in London and the Midlands.[255]",
21-Apr-20,0,"True UK death toll revealed: over 40,000","UK coronavirus deaths are more than double the official figure, it is revealed. With the Government tally of 17,337 deaths only counting those who died in hospital after testing positive for Covid-19, a Financial Times analysis of 'excess deaths' based on Office for National Statistics data shows that the true number of coronavirus deaths is around 41,000. (Financial Times)"
21-Apr-20,0,80 frontline health workers have died from coronavirus,"Calls grow for an inquiry into the ""grotesque"" failure to provide adequate protective gear to frontline staff, following the news that 80 health and social care staff have died from Covid-19. They are disproportionately from the BAME community. (Politics Home)"
21-Apr-20,0,Death toll surges in area around Cheltenham Racecourse,"Gloucestershire hospitals NHS trust, which covers Cheltenham, has now recorded 125 deaths, roughly double that of two nearby trusts in Bristol (58 each), and those covering Swindon (67) and Bath (46). (Guardian)"
21-Apr-20,0,"A further 823 deaths are recorded, taking the total to 17,337, a sharp rise on the previous day, but many of these relate to deaths that occurred in previous days and weeks, and some date back as far as March. Prof Sir David Spiegelhalter, of the University of Cambridge, says the figures suggest the UK is past the peak and in a ""steadily"" albeit slowly improving position.[256][257]",
21-Apr-20,0,"Figures released by the Office for National Statistics indicate deaths in England and Wales have reached a twenty year high, with 18,500 deaths from all causes in the week up to 10 April, about 8,000 more than the average for that time of year.[256] The deaths include those in care homes, where the 1,043 year-to-date deaths related to COVID-19 is a jump from the 217 reported a week ago.[258]",
21-Apr-20,0,"Matt Hancock says the government is ""throwing everything"" at developing a vaccine as he announces £42.5m for clinical trials being conducted by Imperial College London and the University of Oxford.[259]",
21-Apr-20,0,Parliament reconvenes after the Easter recess with MPs approving a new arrangement with some in the House of Commons chamber and some attending via video link.[260],
21-Apr-20,0,Fundraiser Captain Tom Moore is the guest of honour at the opening of NHS Nightingale Hospital Yorkshire and the Humber in Harrogate.[261],
22-Apr-20,0,PPE from Turkey finally arrives – but only 1 in 10 gowns is delivered,"Just 32,000 of the expected 400,000 gowns arrive in Britain. It is only enough to last a few hours on the coronavirus frontline. (Health Service Journal)"
22-Apr-20,0,Contact tracing to restart,"The Government announces it is training an 'army' of 15,000 tracers within the next three weeks, resuming a policy it scrapped in early March, finally mimicking the 'test, trace, isolate' strategy which has proven effective in South Korea, where Covid-19 deaths have remained under 250, despite a similar-sized population to the UK. (Times)"
22-Apr-20,0,"Figures show that UK inflation fell to 1.5% in March, largely because of falls in the price of clothing and fuel ahead of the lockdown.[262]",
22-Apr-20,0,"Parliament holds the first virtual Prime Minister's Questions with Dominic Raab standing in for Boris Johnson, at which Raab confirms the target of 100,000 tests a day by the end of the month.[263]",
22-Apr-20,0,"The number of recorded deaths rises by 759 to 18,100.[263]",
22-Apr-20,0,"In a Commons statement Matt Hancock tells MPs ""we are at the peak"" of the outbreak but social distancing measures cannot be relaxed until the government's five tests have been met.[264] Professor Chris Whitty, the government's chief medical adviser, tells the Downing Street briefing the UK will have to live with some social distancing measures for at least the rest of the year, and that it is ""wholly unrealistic"" to expect life to suddenly return to normal in the short term.[265]",
22-Apr-20,0,Doctors in Wales have written a joint letter to First Minister Mark Drakeford urging him to ban the use of second homes during the outbreak.[266],
23-Apr-20,0,Government announces testing kit website for key workers,"The initiative will make it ""easier, faster, and simpler for any essential worker in England, who needs a test, to get a test,"" says Health Secretary Matt Hancock. (ITV News)"
23-Apr-20,0,Testing kit website for key workers runs out within minutes of launch,"Website for home testing kits made available to 10 million key workers runs out within minutes of opening as only 5,000 kits are made available for the first day. (Bloomberg)"
23-Apr-20,0,"The number of recorded deaths increases by 616 to 18,738.[267]",
23-Apr-20,0,The first human trials of a coronavirus vaccine in Europe begin in Oxford.[268],
23-Apr-20,0,"A study involving 20,000 households in England, coordinated by the Office for National Statistics, will track the progress of COVID-19 and seek to better understand infection and immunity levels, with volunteers asked to provide nose and throat swabs on a regular basis to determine whether they have the virus.[269]",
23-Apr-20,0,"Matt Hancock states that daily test capacity has reached 51,000, and announces that all key workers and members of their households are now eligible for COVID-19 tests and will be able to book tests through the government website from the following day.[270] Tests will be conducted at drive-through centres or using home testing kits,[271] while mobile testing units operated by the armed forces would increase in number from the present eight to 92, with a further four operated by civilians in Northern Ireland.[272]",
23-Apr-20,0,"Hancock also announces preparations to reactivate contact tracing in a later phase of the outbreak, including the recruitment of 18,000 contact tracers to greatly supplement Public Health England's staff.[270]",
23-Apr-20,0,"As the Scottish Government publishes details of a strategy for ending lockdown, Nicola Sturgeon, the First Minister of Scotland, says the lifting of restrictions in Scotland is ""likely to be phased"" with some measures remaining in place until 2021 ""and beyond"".[273]",
23-Apr-20,0,DIY chain B&Q confirms it has reopened 155 of its stores following a trial opening of a small number of outlets the previous weekend.[274],
23-Apr-20,0,"BBC One airs The Big Night In, a first-of-its-kind joint broadcast with Children in Need and Comic Relief, and featuring an evening of music and entertainment. The broadcast celebrates the acts of kindness, humour and the spirit of hope and resilience that is keeping the nation going during the unprecedented COVID-19 pandemic, with viewers given a chance to donate to a fund helping local charities and projects around the country.[275] The event raises £27m for charity, with the government pledging to double that amount.[276]",
23-Apr-20,0,At 8pm the UK stages a fifth round of applause for NHS staff and key workers.[277],
24-Apr-20,0,"Official UK death toll reaches 20,000","The likely true figure is over 45,000 people. Covid-19 has killed more Britons than died in The Blitz."
24-Apr-20,0,"A further 768 recorded deaths takes the total to 19,506.[278]",
24-Apr-20,0,"The website for key workers to book a coronavirus test temporarily closes after a high demand for the tests; 5,000 test kits are ordered within its first two minutes online. The government says it will make more tests available.[279]",
24-Apr-20,0,"Transport Secretary Grant Shapps announces bilateral discussions with the Irish and French governments to safeguard freight routes, and with the Northern Ireland Executive regarding support for passenger flights.[280] Funding is to be provided to support ferry routes to Northern Ireland,[280] the Isle of Wight and the Isles of Scilly.[281]",
24-Apr-20,0,"A version of ""You'll Never Walk Alone"" recorded by Captain Tom Moore and Michael Ball to raise money for the NHS Charities Together fund reaches number one in the UK Singles Chart.[282]",
24-Apr-20,0,The Northern Ireland Executive agrees to reopen cemeteries in Northern Ireland following public pressure; they had been closed since March.[283],
25-Apr-20,0,"After figures show that A&E attendances are half their usual level, the health service urges people to seek healthcare if needed and not be put off by the coronavirus outbreak.[285]",
25-Apr-20,0,Care home deaths spike as hospital deaths fall,"A third of all coronavirus deaths in England and Wales are now occurring in care homes. The past week has seen 2,000 coronavirus-related deaths in care homes – double that of the previous week, with total deaths now at 3,096. (BBC News)"
25-Apr-20,0,"The number of recorded deaths increases by 813, taking the total past 20,000 to 20,319. Thus the UK becomes the fifth country to pass the 20,000 mark along with the United States, Italy, Spain and France.[284]",
25-Apr-20,0,COVID-19 tests for key workers are booked up within an hour.[286],
25-Apr-20,0,"Guernsey partially lifts its lockdown restrictions, allowing gardeners, mechanics, estate agents and builders to return to work.[287]",
26-Apr-20,0,"The number of recorded deaths rises by 413 taking the total to 20,732. The figure of 413 is the lowest daily total in April.[288]",
