Date,Relevance,Headline,Detail (Source)
16-May-20,0,"The number of recorded deaths increases by 468 to 34,466.[396]",
16-May-20,0,"Anne Longfield, the Children's Commissioner for England, urges the government and teaching unions to ""stop squabbling and agree a plan"" to reopen schools, warning that the closure of schools is impacting negatively on disadvantaged children.[397]",
16-May-20,0,"Coronavirus protests involving the gathering of people are held at venues around the UK, including Hyde Park in London, and Glasgow Green in Glasgow.[398][399]",
17-May-20,0,Italy eases lockdown,"Shops, restaurants and hair salons reopen, as social distancing rules remain. (Reuters)"
17-May-20,0,"In an article for The Mail on Sunday, Boris Johnson acknowledges frustrations with the government's ""stay alert"" message for England, but urges the public to be patient as the lockdown measures are eased.[400]",
17-May-20,0,"The number of recorded deaths rises by 170 to 34,636. The daily increase is the lowest since the day after the lockdown restrictions were introduced.[401]",
17-May-20,0,"At the Downing Street daily briefing, Business Secretary Alok Sharma announces a further £84m of funding to help mass-produce a COVID-19 vaccine being trialled by the University of Oxford and that should be available by September. He also tells the briefing that Oxford have secured an agreement with pharmaceutical company AstraZeneca to manufacture the vaccine, and distributed it to the UK first.[402]",
18-May-20,1,The UK adds loss of smell and loss of taste to the list of COVID-19 symptoms that people should look out for.[406],
18-May-20,0,New Zealand records a further two days without new coronavirus cases,"The country has now had eight days in May without new cases reported and just over 1,500 total infections. (Reuters)"
18-May-20,0,"Rail operators begin running more train services, while security guards trained in crowd control are placed on duty at some major railway stations.[403]",
18-May-20,0,"The London congestion charge is reinstated, and buses in London begin charging passenger fares once again. As part of the £1.6bn deal to bail out Transport for London, the congestion charge will also rise from £11.50 to £15 from 22 June.[404]",
18-May-20,0,"Jury trials resume at a handful of courts in England and Wales, having been suspended since the beginning of the lockdown restrictions.[405]",
18-May-20,0,Health Secretary Matt Hancock announces that anyone in the UK over the age of five with symptoms can now be tested for COVID-19.[407],
18-May-20,0,"Matt Hancock also confirms that 21,000 contact tracers have been recruited across the UK and are ready to begin work.[408]",
18-May-20,0,"The number of recorded deaths rises by 160 to 34,796.[409]",
18-May-20,0,Foreign Secretary Dominic Raab tells the Downing Street daily briefing that it is “not sustainable” to keep the lockdown in place “permanently” but that the Government is monitoring the changes it makes.[410],
18-May-20,0,First Minister of Scotland Nicola Sturgeon sets out plans to begin easing Scotland's lockdown restrictions from 28 May.[411],
18-May-20,0,"The 2020 Chelsea Flower Show begins, and is held as a virtual festival for the first time.[412]",
18-May-20,0,English Premier League football clubs vote to allow teams to begin training in small groups from the following day as a step towards restarting football in England.[413],
18-May-20,0,Celtic are declared Scottish champions for the ninth season in a row while Hearts are relegated after the Scottish Professional Football League ends the 2019–20 season early because of the COVID-19 outbreak.[414],
19-May-20,0,"Over 11,000 coronavirus deaths in UK care homes (BBC News)",
19-May-20,0,World sees largest daily rise in coronavirus cases,"The WHO issues a stark warning that the pandemic is far from over as 106,000 new cases are recorded globally in 24 hours, the most in a single day to date. (Guardian)"
19-May-20,0,"Northern Ireland further eases its lockdown measures. Groups of up to six people who do not share the same household are allowed to meet up outdoors, so long as they maintain social distancing. Churches are allowed to reopen for private prayer, and the playing of sports such as golf and tennis can resume.[415]",
19-May-20,0,"Figures from the Office for National Statistics show the number of people claiming Jobseeker's Allowance increased by 856,500 in April, to 2.1 million. In response to this Chancellor Rishi Sunak says that it will take time for the UK economy to recover and it is ""not obvious there will be an immediate bounceback"".[416]",
19-May-20,0,"A further 545 deaths are recorded, taking the total to 35,341.[417]",
19-May-20,0,"As figures show there have been 11,600 deaths in care homes as a result of COVID-19, Professor Martin Green, chair of Care England, criticises the government for the way it handled the outbreak in care homes, and tells MPs they should have been prioritised from the start.[418]",
19-May-20,0,"Security researchers identify major security issues with the NHS COVID-19 tracing app being piloted on the Isle of Wight, and call for new legislation to prevent officials using the data collected for purposes other than identifying those at risk from the virus.[419]",
19-May-20,0,"Captain Tom Moore, who raised £32m for NHS charities, is to be knighted for his fundraising efforts following a special nomination from Boris Johnson.[420]",
20-May-20,0,"Europe should prepare for a second wave of Covid-19 cases, says EU coronavirus chief","""The question is when and how big"" a second wave of infections will be, says Dr Andrea Ammon of the European Centre for Disease Prevention and Control. (Guardian)"
20-May-20,0,"Tens of thousands of UK coronavirus tests are being double-counted, it is revealed","Multiple samples from the same patient are being recorded as separate tests in official figures, UK public health officials admit. (Telegraph)"
20-May-20,0,"At Prime Minister's Questions, Boris Johnson confirms that a track and trace system will be in place from 1 June.[421]",
20-May-20,0,"The Government faces mounting pressure from councils and teaching unions to reconsider its plans to reopen primary schools from 1 June. Robert Buckland, the Secretary of State for Justice, says the Government is taking all concerns ""very seriously"">[422]",
20-May-20,0,"Rolls-Royce announce plans to cut 9,000 jobs as a result of the COVID-19 outbreak, and warns that it could take several years for the airline industry to recover.[423]",
20-May-20,0,"The number of recorded deaths rises by 363 to 35,704.[424]",
20-May-20,0,"The number of people in hospital with COVID-19 drops below 10,000 for the first time since March.[425]",
20-May-20,0,"People with diabetes are being strongly advised to follow government advice after a study by NHS England found the condition was linked to a third of coronavirus deaths between 1 March and 11 May. Diabetics are not among the people who have been told to shield themselves, but some may be asked to do so if they are deemed to be at high risk because of a combination of health conditions.[426]",
20-May-20,0,"At the Downing Street daily briefing, Secretary of State for Digital, Culture, Media and Sport Oliver Dowden announces the establishment of a task force that will look at how sporting and arts events can resume safely. The task force will include former women's footballer Alex Scott and television executive Michael Grade.[427]",
20-May-20,0,Dowden announces that £150m from dormant bank accounts will be used to help charities and social enterprises.[428],
20-May-20,0,"The 2020 Queen's Birthday Honours is delayed until the autumn in order to recognise the ""everyday Covid heroes"" who have played a role in supporting and protecting society during the crisis.[429]",
20-May-20,0,Figures released by Public Health England indicate no new coronavirus cases were reported in London over the 24-hour period up to Monday 18 May.[430],
21-May-20,0,"Arrivals to the UK will need to isolate, Government says","Arrivals to the UK will have to quarantine for two weeks or face a fine, the Government announces, nearly 4 months after the first UK cases. (Guardian)"
21-May-20,0,"The NHS Confederation warns that time is running out to finalise a test, track and trace strategy to avoid a possible second surge in coronavirus cases.[431]",
21-May-20,0,"First Minister of Scotland Nicola Sturgeon outlines a four-phase ""route map"" for easing lockdown restrictions in Scotland that will include allowing people to meet up outside with people from one other household in the first phase. The lockdown will be eased from 28 May subject to the number of new cases of COVID-19 continuing to fall.[432] Schools in Scotland will reopen on 11 August, when students will receive a ""blended model"" of part-time study at school combined with some learning at home.[433]",
21-May-20,0,"Northern Ireland Education Minister Peter Weir outlines plans for schools to reopen in Northern Ireland in August, with a phased return for students.[434]",
21-May-20,0,"Following an agreement between the Government and the Swiss pharmaceutical company Roche, a COVID-19 antibody test is made available through the NHS, with health and care staff to be the first to receive it. The test checks to see if someone has had the virus.[435]",
21-May-20,0,The Government announces that NHS staff and care workers from overseas will be exempt from the immigration health surcharge that usually applies to non-EU migrants.[436],
21-May-20,0,"The number of recorded deaths rises by 338 to 36,042.[437]",
21-May-20,0,"The Office for National Statistics estimate that 137,000 people in England, or 0.25% of the population, had COVID-19 at any given time between 4 May and 17 May (excluding those in hospitals, care homes or other institutions). This implies around 8,700 new infections per day, compared to the 10,000 estimate made two weeks ago.[438]",
21-May-20,0,"ITV announces that its soap Emmerdale has started a ""phased return to filming"" with six new episodes being recorded at its studios in Leeds.[439]",
21-May-20,0,The UK stages its ninth weekly Clap for Our Carers event at 8pm.[440],
22-May-20,0,Cummings lockdown breach revealed (Mirror),
22-May-20,0,"Johnson has ""trashed"" his own public health advice in order to defend Dominic Cummings, says Government's own scientist","“Boris Johnson has trashed all the advice we have given on how to build trust and secure adherence to the measures necessary to control Covid-19,” says scientific adviser Professor Stephen Reicher. (Twitter)"
22-May-20,0,"The number of recorded deaths rises by 351 to 36,393.[441]",
22-May-20,0,The Government unveils new quarantine rules for travellers to the UK that will require them to self-isolate for fourteen days from 8 June.[442],
22-May-20,0,"The Scientific Advisory Group for Emergencies publishes its evidence on the safety and impact of reopening schools on 1 June. It says the risk to school pupils is ""very, very small, but it is not zero"", while the risk to teachers is not above average when compared to other occupations.[443]",
22-May-20,0,"The Office for National Statistics reports that government borrowing rose to £62bn in April, the highest monthly figure on record, after heavy spending to ease the coronavirus crisis.[444]",
22-May-20,0,"Guernsey announces plans to move to Stage Four of its lockdown restrictions from 30 May, six weeks earlier than originally planned. This will allow restaurants and cafes, hairdressers and beauticians, cinemas, gyms and sports venues to reopen. The announcement comes after the island had 22 consecutive days with no new COVID-19 cases.[445] Schools on the island will also reopen for all students on 8 June.[446]",
22-May-20,0,"Annemarie Plas, credited as starting the weekly Clap for Our Carers, suggests it should end after its tenth week as the public have shown their appreciation, and should instead become an annual celebration of frontline workers.[447]",
23-May-20,1,"Dominic Cummings, Boris Johnson's chief political adviser, comes under mounting pressure to resign after a joint investigation by the Daily Mirror and The Guardian revealed that he travelled 260 miles from London to Durham to self-isolate during lockdown and while his wife was displaying COVID-19 symptoms. In response to the story, Downing Street says that Cummings travelled to the north east to be near relatives who could look after his young son if he became ill himself.[450]",Example of general population questioning government advice ?
23-May-20,0,Johnson again backs Cummings who says he has 'no regrets',"Controversy engulfs Johnson's administration, as ministers double-down on their support for the Chief Adviser following his apparent breach of lockdown rules. Johnson says that Cummings did ""what any father would have done"". (Guardian)"
23-May-20,0,The French Government announces that travellers to France from the UK will have to quarantine for fourteen days from 8 June.[448],
23-May-20,0,"The number of recorded deaths rises by 282 to 36,675. The latest deaths include that of a 12-year-old child.[449]",
23-May-20,0,"Transport Secretary Grant Shapps announces £283m of investment in buses and light rail services in order to help improve safety, but warns capacity will be at a fifth of pre-lockdown levels because of social distancing measures. Extra martials at stations from 1 June are also announced, as well as permission for ten rail reopening projects to proceed to make business cases under the ""reversing the Beeching cuts"" initiative.[451]",
24-May-20,0,"A further 118 deaths are recorded in the UK, taking the total to 36,793.[452]",
24-May-20,0,"After The Observer and the Sunday Mirror print allegations that Dominic Cummings made a second trip to the north east during lockdown, Boris Johnson gives his chief aide his backing at the Downing Street daily briefing, saying that Cummings had ""no alternative"" but to travel for childcare ""when both he and his wife were about to be incapacitated by coronavirus"" and has ""acted responsibly, legally and with integrity"". Johnson describes some of the claims as ""palpably false"".[453]",
24-May-20,0,"Johnson also confirms plans (outlined on 10 May) for the phased reopening of schools in England from 1 June: from that date, they will reopen for early years pupils, Reception, Year 1 and Year 6. For the first time he states that from 15 June a quarter of Year 10 and Year 12 students will be allowed ""some contact"" to help prepare for exams.[454]",
25-May-20,0,NHS faces huge backlog of routine operations due to lack of PPE and staff testing,"A lack of protective gear and long waits for tests for NHS staff are preventing hospitals from dealing with backlogs of operations, a leading NHS figure warns. (Guardian)"
25-May-20,0,"No more than 80,000 tests a day have ever been carried out in the UK","Government double-counting of tests has masked the fact that the UK has never achieved more than 80,000 tests a day, despite setting a target of 100,000 daily tests on 2 April. (Times)"
25-May-20,0,"Dominic Cummings says ""I don't regret what I did"" as he gives a detailed explanation of his actions during lockdown at a press conference in the Downing Street Rose Garden.[455]",
25-May-20,0,"A further 121 recorded deaths take the total to 36,914.[456]",
25-May-20,0,"Boris Johnson outlines plans to reopen car showrooms and outdoor markets from 1 June, and for all non-essential shops to reopen from 15 June.[457]",
25-May-20,0,"Education Secretary Gavin Williamson warns the virus ""could be with us for a year or more"" and children cannot stay off school for ""months and months"".[458]",
25-May-20,0,Weston General Hospital in Somerset temporarily stops admitting new patients because of a high number of COVID-19 cases.[459],
25-May-20,0,"The Football Association confirms that the 2019–20 Women's Super League and 2019–20 Women's Championship have ended immediately, with the outcome of winners and relegations to be decided.[460]",
26-May-20,0,"A further 134 recorded deaths brings the total to 37,048.[461]",
26-May-20,0,"For the first day since 18 March, no new COVID deaths are reported in Northern Ireland. Robin Swann, the Northern Ireland Health Minister, describes it as ""a clear sign of progress"".[462]",
26-May-20,0,Death registration figures for the week ending 15 May show the lowest number of COVID-19 deaths since the beginning of April.[463],
26-May-20,0,"Remdesivir, a drug that can speed up the recovery time of patients with COVID-19, is made available through the NHS.[464]",
26-May-20,0,"The Scottish Government announces plans for Test and Protect, a track and trace system.[465]",
26-May-20,0,"Douglas Ross resigns as a junior minister with the Scotland Office over the government's defence of Dominic Cummings, while at least 35 Conservative MPs call for Cummings to be removed from his post.[466]",
26-May-20,0,Tate Britain announces that the annual Turner Prize will not be awarded in 2020 because of the upheaval created by the COVID outbreak.[467],
27-May-20,1,"Boris Johnson presides over the nation that also has the second highest overall death toll, estimated by the Financial Times at 60,000. Nearly one in every thousand Britons has died. (Financial Times)",
27-May-20,0,"US coronavirus death toll reaches 100,000 (New York Times)",
27-May-20,0,UK now has second highest per capita excess death rate of any nation on Earth,
27-May-20,0,"The number of recorded deaths increases by 412, taking the total to 37,460.[468]",
27-May-20,0,Boris Johnson states that a test and trace system will be operational in England from the following day.[469],
27-May-20,0,Johnson appears before the House of Commons Liaison Committee where he rules out holding an inquiry into the actions of Dominic Cummings.[470],
27-May-20,0,"Figures from HM Treasury indicate the Coronavirus Job Retention Scheme for furloughed workers in the UK now covers 8.4 million people, an increase from 8 million a week earlier.[471]",
27-May-20,0,Premier League football clubs vote to resume contact training.[472],
28-May-20,0,"The weekly household survey by the Office for National Statistics reports that around 133,000 people in England had COVID-19 at any given time during 11–24 May, and estimates the rate of new infections to be around 54,000 per week. Both numbers are similar to the previous estimates, indicating that the number of infections is ""relatively stable"".[477]",
28-May-20,0,"Contact tracing systems go live in England and Scotland – NHS Test and Trace in England, and Test and Protect in Scotland.[473] However, Dido Harding tells MPs the system in England will not be ""fully operational at a local level"" until the end of June.[474][475]",
28-May-20,0,"The number of recorded deaths rises by 377 to 37,837.[476]",
28-May-20,0,"A meeting of the four national Chief Medical Officers decides that the alert level should remain at 4, although Boris Johnson had said the previous day that he hoped it would come down to 3.[478]",
28-May-20,0,"Johnson says the government's five tests have been met, and from 1 June in England groups of up to six people will be able to meet outdoors in gardens and outdoor private spaces.[479] Dental practices will be allowed to reopen from 8 June.[140]",
28-May-20,0,"First Minister of Scotland Nicola Sturgeon announces an easing of lockdown measures in Scotland from the following day, when people from two different households can meet up outdoors as long as they are groups of eight or less.[480]",
28-May-20,0,"The Northern Ireland Executive agrees to further relax lockdown restrictions from 8 June, when large retailers, car showrooms and shops in retail parks will be allowed to open, and outdoor weddings attended by ten people will be permitted.[481]",
28-May-20,0,"Durham Police say that Dominic Cummings may have made a ""minor breach"" of lockdown rules during his visit to Barnard Castle, but no offence was committed.[482]",
28-May-20,0,"Premier League clubs agree to restart games on 17 June, with two matches – Aston Villa v Sheffield United and Manchester City v Arsenal.[483] All 92 remaining matches from the season will air live on television.[484]",
28-May-20,0,"EasyJet announces plans to cut 4,500 jobs because of the effects of the COVID-19 outbreak on business.[485]",
28-May-20,0,The tenth Clap for Our Carers event is staged at 8pm.[486],
29-May-20,1,Lockdown measures are eased in Scotland.[491],
29-May-20,0,"The number of recorded deaths increases by 324 to 38,161.[487]",
29-May-20,0,"Chancellor Rishi Sunak announces that the Coronavirus Job Retention Scheme will end at the end of October. Before then, employers must pay National Insurance and pension contributions from August, then 10% of pay from September, increasing to 20% in October.[488] Self-employed people whose work has been affected by the outbreak will receive a ""second and final"" government grant in August.[489]",
29-May-20,0,"Mark Drakeford, the First Minister of Wales, announces an easing of the lockdown restrictions for Wales from Monday 1 June, that will allow the members of two households to meet up outdoors. Non-essential retailers are urged to use the next three weeks to ""prepare safeguarding"".[490]",
29-May-20,0,"A rehabilitation centre for COVID-19 patients receives its first patients. NHS Seacole, based at Headley Court in Surrey, is named for the British-Jamaican nurse Mary Seacole.[492]",
30-May-20,0,"Some government scientific advisers warn of the risk associated with lifting lockdown restrictions in England too early, citing the still high number of cases and deaths. In response the government says it is following the data and evidence when making its decisions about the restrictions.[493] Professor Jonathan Van-Tam tells the Downing Street briefing that Britain is at a ""dangerous moment"" and people must be ""sensible and proportionate"".[494]",
30-May-20,0,"The number of recorded deaths increases by 215 to 38,376.[495]",
30-May-20,0,"At the Downing Street daily briefing Culture Secretary Oliver Dowden announces that competitive sport will be allowed in England behind closed doors from 1 June, with individual sporting bodies left to decide when to restart. Horse racing will be one of the first sporting activities to resume.[496]",
30-May-20,0,"Boris Johnson announces a relaxing of lockdown restrictions for the 2.2 million people who have been ""shielding"" in their homes, with them allowed outdoors with members of their household from 1 June. Those who live alone can meet one other person outside.[497]",
30-May-20,0,Conservative MPs urge Boris Johnson to revise the 2 metre social distancing rule to 1.5 metres amid concerns for the hospitality industry.[498],
31-May-20,0,"The number of recorded deaths rises by 113 to 38,489.[499]",
31-May-20,0,"The UK exceeds its target to increase testing capacity to 200,000 tests a day by the end of May, with 205,634 available for 30 May.[500]",
31-May-20,0,"Some scientists express their concern about the logic of relaxing lockdown rules for those shielding at home in England.[501] In response Robert Jenryck tells the Downing Street daily briefing he is ""reasonably confident"" the measures are ""manageable"" but the room for manoeuvre is limited.[500]",
31-May-20,0,"Welsh health minister Vaughan Gething announces an easing of lockdown rules for those shielding at home in Wales. From 1 June they may meet up outside with people from another household, but must maintain social distancing rules and must not go into another person's home.[502]",
01-Jun-20,1,"The third amendment to the Coronavirus Restrictions legislation comes into effect, again without prior parliamentary scrutiny. Car and caravan showrooms, outdoor sports amenities and outdoor non-food markets may reopen. The prohibitions on leaving home are replaced by a prohibition on staying overnight away from home, with specific exceptions such as for work. Gatherings of people from more than one household are limited to six people outdoors and are prohibited entirely indoors, with exceptions including education. There are further exemptions for elite athletes. As primary schools reopen in England, headteachers report a varied attendance rate of between 40% and 70%.",
01-Jun-20,0,"As primary schools reopen in England, headteachers report a varied attendance rate of between 40% and 70%.[504]",
01-Jun-20,0,Furniture retailer Ikea reopens 19 of its UK stores.[505],
01-Jun-20,0,"Horse racing becomes the first sport to return in England after a gap of 76 days, with the first meeting at Newcastle.[506] Snooker also returns.[507]",
01-Jun-20,0,"The number of recorded deaths increases by 556 to 39,045; 111 deaths are recorded from the most recent 24 hour period, while a further 445 are added retrospectively because of delayed reporting.[508][509]",
01-Jun-20,0,"The Northern Ireland Executive agrees to ease the lockdown measures for people shielding at home from 8 June, when they will be allowed outdoors with members of their household, or to meet one member of another household if they are living alone.[510]",
01-Jun-20,0,"ITV announces plans to resume filming of its soap Coronation Street from 9 June following an eleven week break. ITV have aired three episodes a week since March, and the new filming schedule will allow that number of airings to continue.[511]",
02-Jun-20,0,"The number of recorded deaths rises by 324 to 39,369.[512]",
02-Jun-20,0,"Figures from the Office for National Statistics show the number of COVID-19 deaths to be at their lowest since March, with 2,872 death certificates mentioning the condition during the week up to 22 May.[513]",
02-Jun-20,0,"The Guardian has calculated the UK death toll from COVID-19 is 50,032.[514] Meanwhile, Reuters give the figure as 49,646.[515]",
